{"packageSchemaVersion":1,"lessonFlowVersion":1,"lessonId":"test-introductions","contentVersion":2,"publicationState":"published","title":"Introductions v2","description":"TEST-only updated deterministic introduction lesson.","language":"en","referenceLocale":"en-US","cefrBand":"A1","estimatedMinutes":4,"objectives":["Introduce yourself."],"tags":["test-only","phase-w"],"assets":[],"stages":[{"stageId":"theory","stageType":"theory","stageSchemaVersion":1,"title":"Read","instructions":"Read the updated note.","required":true,"payload":{"blocks":[{"type":"paragraph","text":"Hello, I am Alex. Nice to meet you."}]}},{"stageId":"exercise","stageType":"exercise","stageSchemaVersion":1,"title":"Practice","instructions":"Complete the exercise.","required":true,"payload":{"items":[{"exerciseId":"exact","exerciseType":"short_answer_exact","prompt":"Type hello.","instructions":null,"hint":null,"payload":{"acceptedAnswers":["hello"],"normalizationProfile":"english_basic_v1"},"feedback":{"correct":"Correct.","incorrect":"Try again.","explanation":null}}]}},{"stageId":"analysis","stageType":"analysis","stageSchemaVersion":1,"title":"Lesson Review","instructions":"Review your practice.","required":true,"payload":{}}]}
