{"packageSchemaVersion":1,"lessonFlowVersion":1,"lessonId":"test-draft","contentVersion":1,"publicationState":"draft","title":"Draft Lesson","description":"TEST-only draft package.","language":"en","referenceLocale":"en-US","cefrBand":"A1","estimatedMinutes":2,"objectives":["Test draft visibility."],"tags":["test-only"],"assets":[],"stages":[{"stageId":"theory","stageType":"theory","stageSchemaVersion":1,"title":"Read","instructions":"Read.","required":true,"payload":{"blocks":[{"type":"paragraph","text":"Draft."}]}}]}
