{"packageSchemaVersion":1,"lessonFlowVersion":1,"lessonId":"test-travel-problems","contentVersion":1,"publicationState":"published","title":"Travel Problems","description":"TEST-only deterministic B1 travel lesson.","language":"en","referenceLocale":"en-US","cefrBand":"B1","estimatedMinutes":4,"objectives":["Explain a travel problem."],"tags":["test-only","phase-w"],"assets":[],"stages":[{"stageId":"theory","stageType":"theory","stageSchemaVersion":1,"title":"Read","instructions":"Read the note.","required":true,"payload":{"blocks":[{"type":"paragraph","text":"My train has been delayed."}]}},{"stageId":"exercise","stageType":"exercise","stageSchemaVersion":1,"title":"Practice","instructions":"Complete the exercise.","required":true,"payload":{"items":[{"exerciseId":"exact","exerciseType":"short_answer_exact","prompt":"Type delayed.","instructions":null,"hint":null,"payload":{"acceptedAnswers":["delayed"],"normalizationProfile":"english_basic_v1"},"feedback":{"correct":"Correct.","incorrect":"Try again.","explanation":null}}]}},{"stageId":"analysis","stageType":"analysis","stageSchemaVersion":1,"title":"Lesson Review","instructions":"Review your practice.","required":true,"payload":{}}]}
